{
  "schemaVersion": "1.0.0",
  "gameBuildId": "23261523",
  "towers": [
    {
      "id": "arc-tower",
      "sourceKey": "ArcTower",
      "sortOrder": 0,
      "name": {
        "en": "Arc Tower",
        "de": "Arc Tower"
      },
      "effectSummary": {
        "en": "Chains electrical attacks between enemies and ignores blocking.",
        "de": "Verkettet elektrische Angriffe zwischen Gegnern und ignoriert Blocken."
      },
      "visual": {
        "kind": "image",
        "assetId": "arc-tower-visual",
        "path": "src/assets/entities/towers/arc-tower.png",
        "width": 30,
        "height": 32,
        "sha256": "4a020c30d81fdbd7d290d3c0c3e0b61501b4e1090b7435939b80024b2a944238",
        "authorship": "authorized",
        "licenseReference": "src/assets/entities/towers/extraction-manifest.json",
        "alt": {
          "en": "Arc Tower icon",
          "de": "Symbol für Arc Tower"
        }
      },
      "provenanceRef": "tower-arc-tower-source"
    },
    {
      "id": "arrow-tower",
      "sourceKey": "ArrowTower",
      "sortOrder": 1,
      "name": {
        "en": "Arrow Tower",
        "de": "Arrow Tower"
      },
      "effectSummary": {
        "en": "Fires dependable ranged arrows with balanced damage and speed.",
        "de": "Feuert zuverlässige Fernkampfpfeile mit ausgewogenem Schaden und Tempo."
      },
      "visual": {
        "kind": "image",
        "assetId": "arrow-tower-visual",
        "path": "src/assets/entities/towers/arrow-tower.png",
        "width": 44,
        "height": 25,
        "sha256": "05f58aa6b029f4d32b56b6e468c70fe5326efda34fa9fd51205d66b4e95fb244",
        "authorship": "authorized",
        "licenseReference": "src/assets/entities/towers/extraction-manifest.json",
        "alt": {
          "en": "Arrow Tower icon",
          "de": "Symbol für Arrow Tower"
        }
      },
      "provenanceRef": "tower-arrow-tower-source"
    },
    {
      "id": "frost-tower",
      "sourceKey": "FrostTower",
      "sortOrder": 2,
      "name": {
        "en": "Frost Tower",
        "de": "Frost Tower"
      },
      "effectSummary": {
        "en": "Uses slow frost attacks that bypass blocking and hinder enemies.",
        "de": "Nutzt langsame Frostangriffe, die Blocken umgehen und Gegner behindern."
      },
      "visual": {
        "kind": "image",
        "assetId": "frost-tower-visual",
        "path": "src/assets/entities/towers/frost-tower.png",
        "width": 32,
        "height": 33,
        "sha256": "87846a715b5802effa055f16222a8a0cfc6f4ea861ac67046678cc899ea474ab",
        "authorship": "authorized",
        "licenseReference": "src/assets/entities/towers/extraction-manifest.json",
        "alt": {
          "en": "Frost Tower icon",
          "de": "Symbol für Frost Tower"
        }
      },
      "provenanceRef": "tower-frost-tower-source"
    },
    {
      "id": "volcano-mortar",
      "sourceKey": "VolcanoMortarTower",
      "sortOrder": 3,
      "name": {
        "en": "Volcano Mortar",
        "de": "Volcano Mortar"
      },
      "effectSummary": {
        "en": "Launches long-range explosive shots that leave burning areas.",
        "de": "Verschießt weitreichende Explosivgeschosse, die Brandflächen hinterlassen."
      },
      "visual": {
        "kind": "image",
        "assetId": "volcano-mortar-visual",
        "path": "src/assets/entities/towers/volcano-mortar.png",
        "width": 40,
        "height": 29,
        "sha256": "2dafd5db4964a8a55405c781b905f800c5ce5dda00fc8b623cb08741fb60d069",
        "authorship": "authorized",
        "licenseReference": "src/assets/entities/towers/extraction-manifest.json",
        "alt": {
          "en": "Volcano Mortar icon",
          "de": "Symbol für Volcano Mortar"
        }
      },
      "provenanceRef": "tower-volcano-mortar-source"
    },
    {
      "id": "shadow-tower",
      "sourceKey": "ShadowTower",
      "sortOrder": 4,
      "name": {
        "en": "Shadow Tower",
        "de": "Shadow Tower"
      },
      "effectSummary": {
        "en": "Strikes rapidly through armor and works with weakness effects.",
        "de": "Greift schnell durch Rüstung hindurch an und nutzt Schwächeeffekte."
      },
      "visual": {
        "kind": "image",
        "assetId": "shadow-tower-visual",
        "path": "src/assets/entities/towers/shadow-tower.png",
        "width": 32,
        "height": 31,
        "sha256": "8114aa7e9e29a10160266c955ddb5ea76248a649f25e8be6c72b520f8ab494f2",
        "authorship": "authorized",
        "licenseReference": "src/assets/entities/towers/extraction-manifest.json",
        "alt": {
          "en": "Shadow Tower icon",
          "de": "Symbol für Shadow Tower"
        }
      },
      "provenanceRef": "tower-shadow-tower-source"
    },
    {
      "id": "runestone-tower",
      "sourceKey": "ObliskTower",
      "sortOrder": 5,
      "name": {
        "en": "Runestone Tower",
        "de": "Runestone Tower"
      },
      "effectSummary": {
        "en": "Projects rapid runic beams and can support nearby towers.",
        "de": "Projiziert schnelle Runenstrahlen und kann nahe Türme unterstützen."
      },
      "visual": {
        "kind": "image",
        "assetId": "runestone-tower-visual",
        "path": "src/assets/entities/towers/runestone-tower.png",
        "width": 46,
        "height": 27,
        "sha256": "95682252a3daccc58c6b02fa289647456d48bdf33106aadea90fe959293d9922",
        "authorship": "authorized",
        "licenseReference": "src/assets/entities/towers/extraction-manifest.json",
        "alt": {
          "en": "Runestone Tower icon",
          "de": "Symbol für Runestone Tower"
        }
      },
      "provenanceRef": "tower-runestone-tower-source"
    },
    {
      "id": "tornado-tower",
      "sourceKey": "TornadoTower",
      "sortOrder": 6,
      "name": {
        "en": "Tornado Tower",
        "de": "Tornado Tower"
      },
      "effectSummary": {
        "en": "Creates swift tornadoes whose attacks ignore armor.",
        "de": "Erzeugt schnelle Tornados, deren Angriffe Rüstung ignorieren."
      },
      "visual": {
        "kind": "image",
        "assetId": "tornado-tower-visual",
        "path": "src/assets/entities/towers/tornado-tower.png",
        "width": 28,
        "height": 34,
        "sha256": "610aaae2c112c934f91b32aa9a3d84b40fe03013d752fdd9384296318cf46b8b",
        "authorship": "authorized",
        "licenseReference": "src/assets/entities/towers/extraction-manifest.json",
        "alt": {
          "en": "Tornado Tower icon",
          "de": "Symbol für Tornado Tower"
        }
      },
      "provenanceRef": "tower-tornado-tower-source"
    },
    {
      "id": "raven-tower",
      "sourceKey": "RavenTower",
      "sortOrder": 7,
      "name": {
        "en": "Raven Tower",
        "de": "Raven Tower"
      },
      "effectSummary": {
        "en": "Delivers powerful long-range shots that bypass magical barriers.",
        "de": "Führt mächtige Fernangriffe aus, die magische Barrieren umgehen."
      },
      "visual": {
        "kind": "image",
        "assetId": "raven-tower-visual",
        "path": "src/assets/entities/towers/raven-tower.png",
        "width": 37,
        "height": 28,
        "sha256": "cc78c543e68b2ad99447f37a092c5b229af6f932a82947019767c01cee8e03b3",
        "authorship": "authorized",
        "licenseReference": "src/assets/entities/towers/extraction-manifest.json",
        "alt": {
          "en": "Raven Tower icon",
          "de": "Symbol für Raven Tower"
        }
      },
      "provenanceRef": "tower-raven-tower-source"
    },
    {
      "id": "chaos-reaper",
      "sourceKey": "ChaosReaperTower",
      "sortOrder": 8,
      "name": {
        "en": "Chaos Reaper",
        "de": "Chaos Reaper"
      },
      "effectSummary": {
        "en": "Deals heavy close-range scythe strikes with strong critical and barrier damage.",
        "de": "Verursacht schwere Sensenhiebe im Nahbereich mit hohem Krit- und Barrierschaden."
      },
      "visual": {
        "kind": "image",
        "assetId": "chaos-reaper-visual",
        "path": "src/assets/entities/towers/chaos-reaper.png",
        "width": 55,
        "height": 55,
        "sha256": "2a6caaf47609398fd88311f35adc0404d8fb206111e6540e648af1203ce791d8",
        "authorship": "authorized",
        "licenseReference": "src/assets/entities/towers/extraction-manifest.json",
        "alt": {
          "en": "Chaos Reaper icon",
          "de": "Symbol für Chaos Reaper"
        }
      },
      "provenanceRef": "tower-chaos-reaper-source"
    }
  ],
  "banners": [
    {
      "id": "barrier-shatter",
      "sourceKey": "tower-specific:BarrierBreakerData:BarrierBreakerBannerTitle",
      "sortOrder": 0,
      "classification": "tower-specific",
      "name": {
        "en": "Barrier Shatter",
        "de": "Durchbruch"
      },
      "effectSummary": {
        "en": "Boosts Chaos Reaper damage against health and barriers.",
        "de": "Steigert den Schaden des Chaos Reapers gegen Leben und Barrieren."
      },
      "visual": {
        "kind": "css",
        "assetId": "barrier-shatter-visual",
        "seed": 1,
        "motif": "crest",
        "authorship": "original",
        "licenseReference": "Original CSS visual system in src/components/BannerVisual.vue",
        "alt": {
          "en": "Abstract emblem for Barrier Shatter",
          "de": "Abstraktes Emblem für Durchbruch"
        }
      },
      "provenanceRef": "banner-barrier-shatter-source",
      "towerAffinityId": "chaos-reaper"
    },
    {
      "id": "critical-bleed",
      "sourceKey": "tower-specific:BleedCritsData:BleedCritsTitle",
      "sortOrder": 1,
      "classification": "tower-specific",
      "name": {
        "en": "Critical Bleed",
        "de": "Kritische Blutung"
      },
      "effectSummary": {
        "en": "Converts part of Chaos Reaper critical damage into bleeding stacks.",